datetime,page,title,link,site,user,user_id,cat,text
2023-03-08T06:13:48Z,https://www.ozbargain.com.au/node/761271,"[eBook] The Essential Guide to Loving and Caring for Your Domestic Cat - Free Kindle Edition @ Amazon AU, UK, US",https://www.amazon.com.au/dp/B0BWMQBFJZ,https://www.amazon.com.au,Scrooge McDeal,416369,books-magazines,Free with Kindle. No Kindle unlimited needed. Amazon UK Amazon US The Essential Guide to Loving and Caring for Your Domestic Cat: Prolonging Its Life and Happiness - A Comprehensive and Complete …
2023-03-08T06:22:25Z,https://www.ozbargain.com.au/node/761271,"[eBook] The Essential Guide to Loving and Caring for Your Domestic Cat - Free Kindle Edition @ Amazon AU, UK, US",https://www.amazon.com.au/dp/B0BWMQBFJZ,https://www.amazon.com.au,Scrooge McDeal,416369,books-magazines,Free with Kindle. No Kindle unlimited needed. Amazon UK Amazon US The Essential Guide to Loving and Caring for Your Domestic Cat: Prolonging Its Life and Happiness - A Comprehensive and Complete …
2023-03-09T01:09:08Z,https://www.ozbargain.com.au/node/761428,"Acer Aspire 7 i5-1240P, 16GB DDR4, 512GB SSD, GTX1650 4GB, 15.6"" FHD IPS 144Hz $897 + Delivery ($0 C&C/In Store) @ Harvey Norman",https://www.harveynorman.com.au/acer-aspire-7-15-6-inch-i5-1240p-16gb-512gb-ssd-gtx1650-4gb-gaming-laptop.html,https://www.harveynorman.com.au,ChatGPT,24873,computing,"A715-51G-5698 NH.QGBSA.002 Intel Core i5-1240P processor (12 MB Smart Cache, 1.7 GHz with Turbo Boost up to 4.4 GHz, DDR4) 16 GB DDR4 3200MHz Memory 512GB PCIe NVMe SSD NVIDIA® GeForce® …"
2023-03-09T02:44:18Z,https://www.ozbargain.com.au/node/761454,Guinness Draught Can 440ml or Kilkenny Cans 440ml 6-Pack $12.80 ($50 Min Order) + Delivery ($0 C&C/ $250 Order) @ Coles Online,https://shop.coles.com.au/a/alexandria/specials/search/440ml?facet=mfName_ntk_cs%253A%2522Guinness%2522&facet=mfName_ntk_cs%253A%2522Kilkenny%2522&orderBy=PR&pageNumber=1&personaliseSort=false,https://shop.coles.com.au,nutcracker007,357872,alcohol,Guinness Draught Can 440mL 6pack Kilkenny Cans 440mL 6pack $60 Kilkenny Cans 440mL 24 pack $60 Guinness Draught Can 440mL 24 pack Original 20% off Deal post Credit Maltopia Tip Credit …
2023-03-10T01:08:57Z,https://www.ozbargain.com.au/node/760202,"[PC, Epic] Free - Call of The Sea @ Epic Games (10/3 - 17/3)",https://store.epicgames.com/en-US/p/call-of-the-sea,https://store.epicgames.com,dealbot,96859,gaming,"Freebie from Epic Games. As usual, available from 3am AEDT. This week - Rise of Industry."
2023-03-10T02:46:46Z,https://www.ozbargain.com.au/node/761635,Henn na Hotel Tokyo Nishikasai (Robot Hotel) - Double Room from $70/Night @ Booking.com,https://www.booking.com/hotel/jp/henn-na-tokyo-nishikasai.en-gb.html,https://www.booking.com,wisdomtooth,10235,travel,"For those who snapped those cheap Jetstar tickets to Tokyo (or from Virgin, or from that Filipino airline), I thought this was a great deal (especially with children! and especially with children who …"
2023-03-11T01:03:22Z,https://www.ozbargain.com.au/node/761828,"Bauhn 50"" 4K Ultra HD TV $429.00 @ ALDI",https://www.aldi.com.au/en/special-buys/special-buys-sat-18-march/saturday-detail-wk11/ps/p/bauhn-50-4k-ultra-hd-tv-powered-by-tizentm/,https://www.aldi.com.au,WatchNerd,57529,electrical-electronics,"Bauhn 50"" 4K Ultra HD TV powered by Tizen™ Resolution: 3840 x 2160 Built-in speaker USB media playback Ports include 1 x RF (antenna), 3 x HDMI, 1 x audio, 2 x USB, 1 x LAN, 1 x optical and …"
2023-03-11T02:12:25Z,https://www.ozbargain.com.au/node/761842,"[PC, macOS, Epic] FTL: Faster Than Light $1.99 @ Epic Games",https://store.epicgames.com/en-US/p/faster-than-light?epic_affiliate=ggdeals&epic_gameId=f7dc1618d0bd4810a61f50d44333900e,https://store.epicgames.com,apoptygma,80152,gaming,"This ""spaceship simulation roguelike-like"" allows you to take your ship and crew on an adventure through a randomly generated galaxy filled with glory and bitter defeat. Give orders to your …"
2023-03-12T01:08:27Z,https://www.ozbargain.com.au/node/762002,[NSW] Free: Organic Kombucha (Raspberry Lemonade & Mango Passion & Ginger Lemon) @ Parramatta Station (Near Woolies Metro),https://files.ozbargain.com.au/upload/280217/102274/7e9da8bc-afb3-40a9-a03a-373ab0e5a410.jpeg,https://files.ozbargain.com.au,I Smell Pennies,280217,groceries,FREE FREE FREE FREE FREE Here with @bargainsgrabber in Parramatta grabbing them all
2023-03-12T02:37:32Z,https://www.ozbargain.com.au/node/762027,FALHOLMEN Outdoor Table + 4 Chairs with Armrests $229 (Was $409) + Delivery ($5 C&C) @ IKEA,https://www.ikea.com/au/en/p/falholmen-table-4-chairs-w-armrests-outdoor-light-brown-stained-s99217859/#content,https://www.ikea.com,ozvictor,74368,home-garden,"Seems like a good price for an outdoor table set. IKEA members can save $10 using code: QREW$6hxX+ ($50 minimum spend) You can also buy the chair seperately for $35 each, but the chair is not …"
2023-03-13T01:07:31Z,https://www.ozbargain.com.au/node/762163,[iOS] Robin Hood: Archer Sniper (No Ads) $0 (Was $4.49) @ Apple App Store,https://apps.apple.com/au/app/robin-hood-archer-sniper/id1352742584,https://apps.apple.com,Scrooge McDeal,416369,mobile,Freebie!!! Robin Hood: Archer Sniper Was $4.49 - Now Free 4.1 ⭐ out of 5 No data collected About Robin Hood: Archer Sniper Join the epic battle agains the forces of the evil Sheriff in …
2023-03-13T02:30:01Z,https://www.ozbargain.com.au/node/762182,[PS4] Judgment $19.97 @ PlayStation Store,https://store.playstation.com/en-au/product/EP0177-CUSA13197_00-JUDGMENTRYUGAENG,https://store.playstation.com,sammysamsam,78997,gaming,"Judgment is half-price at the PS Store and Lost Judgment, the sequel is $19 at JB HiFi and is part of the 2 for $30 special if you are interested. Link for Lost Judgment Mod Note: Removed …"
2023-03-14T00:56:35Z,https://www.ozbargain.com.au/node/762349,"Coles ½ Price: Latina Filled Pasta 625g $5, Arnott's Mint Slice or Wagon Wheels $2.25, Schmackos Dog Treats 500g $7.50 + More",https://www.coles.com.au/catalogues-and-specials,https://www.coles.com.au,Samwise Gamgee,119247,groceries,"Coles half price specials, valid from Wed 15 March to Tue 21 March. Taken from the VIC metro catalogue. Dairy, Eggs & Meals Was Now Save Discount Dairy Farmers Thick & …"
2023-03-14T02:02:48Z,https://www.ozbargain.com.au/node/762369,Dove Body Wash Pomegranate and Lemon Verbena 1L $7 (RRP $17) + Delivery ($0 with Prime/ $39+ Spend) @ Amazon AU,https://www.amazon.com.au/dp/B07LG5GJPQ,https://www.amazon.com.au,AvidDealHunter,442644,health-beauty,Glowing Mango and Almond’s also on sale for $7 at Amazon
2023-03-15T01:06:58Z,https://www.ozbargain.com.au/node/762579,Roborock S7 Robotic Vacuum Cleaner & Mop - White $534.50 + Delivery ($0 with OnePass) @ Catch,https://www.catch.com.au/product/roborock-s7-robotic-vacuum-cleaner-mop-white-7652692/,https://www.catch.com.au,TungDo,308938,electrical-electronics,I'm looking for a new Vacuum cleaner and found this deal. Not sure when it will end. Q7 is on 50% sale as well https://www.catch.com.au/product/roborock-q7-max-robotic-vac…
2023-03-15T02:28:50Z,https://www.ozbargain.com.au/node/762585,"Qantas American Express Ultimate: Up to 100,000 Qantas Points ($3,000 within 3 months), $450 Travel Credit each yearly, $450 P.A",https://www.pointhacks.com.au/credit-cards/qantas-american-express-ultimate-guide/,https://www.pointhacks.com.au,Pegadeals,220129,financial,Was looking to close my westpac credit card and apply for another card. This card might be worth getting if you are travelling at least once a year. 1.25 Qantas Points earned per $1 on eligible …
2023-03-16T01:06:08Z,https://www.ozbargain.com.au/node/762820,[Afterpay] Samsung Galaxy A53 5G 128GB Black/Blue $379.95 + Delivery ($0 with eBay Plus/C&C) @ Bing Lee eBay,https://www.ebay.com.au/itm/154905905843?media=COPY&mkcid=16&mkevt=1&mkrid=705-154756-20017-0&ssspo=_zO4OeUqTzO&sssrc=2349624&ssuid=tgqjpr_0s3q&widget_ver=artemis,https://www.ebay.com.au,Kanjus,251838,mobile,Cheapest I've seen. One of the few decent sub premium phones with expandable storage. About to be superseded by A54 at double this price. Blue Original Coupon Deal
2023-03-16T02:32:09Z,https://www.ozbargain.com.au/node/762850,"BLACKDOG Beef Liver 1kg $21.73, Chicken Breast 1kg $33.00, Pig Ears 10 Pack $14.99 + Del ($0 with Prime/ $39 Spend) @ Amazon AU",https://www.amazon.com.au/dp/B077S3J6HH,https://www.amazon.com.au,rosebank,446913,pets,"BLACKDOG Beef Liver - 1kg - 57% Off - haven't tried this, but reviews are good and my fucking terrorist of a Kelpie puppy likes pig liver BLACKDOG Chicken Necks - 500g - 34% Off - the little …"
2023-03-17T01:07:58Z,https://www.ozbargain.com.au/node/761404,"[PC, Epic] Free - Warhammer 40,000: Gladius - Relics of War @ Epic Games",https://store.epicgames.com/en-US/p/warhammer-40000-gladius-relics-of-war,https://store.epicgames.com,dealbot,96859,gaming,This has just popped up in the Epic backend. Should be free from 10/3 3am 17/3 2am. Also free from 10/3 3am - Clash - Lone Fighter Pack.
2023-03-17T02:30:39Z,https://www.ozbargain.com.au/node/763120,"[Afterpay] Apple MacBook Air 13'' w/ M1 Chip, 8 Core CPU, 256GB/8GB, MGN63X/A - Space Grey $1149 Delivered @ Techciti eBay",https://www.ebay.com.au/itm/285189177184,https://www.ebay.com.au,Being Askhole,245494,computing,"Original Coupon Deal Enjoy :) Apple MacBook Air 13'' w/ M1 chip, 8 Core CPU, 256GB/8GB, 2020 - Space Grey - Apple-designed M1 chip for a giant leap in CPU, GPU and machine learning …"
2023-03-18T01:04:08Z,https://www.ozbargain.com.au/node/763299,"[eBook] Attack on Titan Vol. 1, Battle Angel Alita Vol. 1, Vinland Saga Vol. 1 & More - Free @ Google Play",https://play.google.com/store/books/details/Hajime_Isayama_Attack_on_Titan?id=0QPzDQAAQBAJ,https://play.google.com,Scrooge McDeal,416369,books-magazines,Manga Comic Volumes: Attack on Titan Vol. 1 Battle Angel Alita Vol. 1 Vinland Saga Vol. 1 Battle Angel Alita: Last Order Omnibus 1 Attack on Titan Vol. 1 (208 pages) In this post-apocalytpic sci-fi …
2023-03-18T02:27:29Z,https://www.ozbargain.com.au/node/763321,4-Port USB 2.0 Ultra Power Port $2.06 (RRP $25.99) + Delivery ($0 with Prime) @ Onvian AU via Amazon AU,https://www.amazon.com.au/dp/B07PDBNVGN,https://www.amazon.com.au,Guke,382208,computing,Thanks to @ismellpennies for the format Great deal on the 4-Port USB 2.0 USB Power Port Promo as follows: Original price: $25.99 Lightning deal price: $9.34 (54% off) Price after 28% coupon: …
2023-03-19T01:10:41Z,https://www.ozbargain.com.au/node/763486,[PC] $0 BFF or Die @ Itch.io,https://asa-studio.itch.io/bff-or-die,https://asa-studio.itch.io,Being Askhole,245494,gaming,"Enjoy :) You and your friends are graduating from the prestigious Intergalactic Time Academy. No time for partying though as your first mission awaits! The Orbees are all missing. Yes, those …"
2023-03-19T02:37:25Z,https://www.ozbargain.com.au/node/763494,"Google Pixel 7 5G Unlocked Smartphone 128GB $787, 256GB $917 + Delivery ($0 to Metro Areas/ C&C/ in-Store) @ Officeworks",https://www.officeworks.com.au/shop/officeworks/p/google-pixel-7-5g-unlocked-smartphone-128gb-obsidian-gopix7128o,https://www.officeworks.com.au,Being Askhole,245494,mobile,$12 cheaper than Google store Use ultimate everyone gift cards for 20k points via Woolworthsor if you bought 10%-15% off GC before Thanks Jee 256GB The Google Pixel 7 is powered by the speedy …
2023-03-20T01:05:57Z,https://www.ozbargain.com.au/node/763653,"Team CX2 2TB 7mm 2.5"" T253X6002T0C101 SATA SSD $139 + Delivery ($0 for Pickup Syd, Melb) @ Scorptec",https://www.scorptec.com.au/product/hard-drives-&-ssds/solid-state-drives-(ssd)/100736-t253x6002t0c101,https://www.scorptec.com.au,onebee,23871,computing,"Is this a new lower price for 2TB Sata SSD? Model: T253X6002T0C101 Team 2TB SSD, CX2, 7mm 2.5"" SATA III, Read up to 540MB/s, Write up to 490MB/s, 1M Hours MTBF, Endurance 1,600TBW centrecom …"
2023-03-20T02:33:14Z,https://www.ozbargain.com.au/node/763674,$15 off Minimum $50 Spend (Membership Required) @ IKEA,https://files.ozbargain.com.au/upload/151218/102453/screenshot_2023-03-20_at_12.16.15_pm.png,https://files.ozbargain.com.au,Gnilgorf,151218,other,"Oh no! We're sorry your last $10 Quarterly Reward got lost on its way to your inbox. To make it up to you, here's a $15 voucher, ready for you to use however you like. Why not check out …"
2023-03-21T01:04:00Z,https://www.ozbargain.com.au/node/763874,[Prime] CableCreation USB to USB C 3m Cable $1.99 Delivered @ CableCreation Official via Amazon AU,https://www.amazon.com.au/dp/B08DTK396H,https://www.amazon.com.au,nicholasv,394840,electrical-electronics,"Hi all, Thanks to ISP for the format and alerting me to the deal. Not much to say, it's a 3m USB C cable for $1.99. Prime membership required otherwise it'll be $4.99 Promo as …"
2023-03-21T02:10:23Z,https://www.ozbargain.com.au/node/763881,Sonic Rechargeable Electric Toothbrush with 6 Brush Heads & Holder $7.99 + Delivery ($0 Prime/$39 Spend) @ Bruvish via Amazon AU,https://www.amazon.com.au/dp/B0897T98GQ,https://www.amazon.com.au,I Smell Pennies,280217,health-beauty,This deal brings it down to an all time low. Stack with discounted gift cards for an even bigger saving! Promo as follows: Original price: $35.39 Lightning deal price: $29.99 (15% off) Price …
